{
  "catalog_id": "working-fluids",
  "catalog_version": "v0.1.0",
  "governed_by": "orbital-thermal-trade-system-model-extension-3a-engineering-spec-v0.4.1 §7, §15.1",
  "authority_note": "Starter bounded entries only. Not endorsed for final flight use. All values require operator review and sourcing before operational use.",
  "entries": [
    {
      "working_fluid_id": "fluid-hexe-v0",
      "schema_version": "v0.2.0",
      "label": "Helium-Xenon Mixture Basis (20/80 mol%)",
      "fluid_class": "noble_gas",
      "phase_class": "single_phase_gas",
      "temp_operating_min_k": 300,
      "temp_operating_max_k": 1300,
      "cp_basis_j_per_kgk": 520,
      "density_basis_kg_per_m3": 8.5,
      "thermal_conductivity_w_per_mk": 0.045,
      "viscosity_basis_pa_s": 3.2e-5,
      "gamma_ratio": 1.67,
      "latent_heat_basis_j_per_kg": null,
      "provenance_class": "sourced_secondary",
      "confidence_class": "medium",
      "maturity_class": "trl_4_5",
      "research_required": true,
      "source_note": "Representative He-Xe mixture properties at ~20/80 mol% basis per Brayton cycle literature. Cp/density at ~1.4 MPa operating point. Verify for specific mixture ratio and pressure.",
      "pressure_notes": "Pressure-dependent properties. Values stated at ~1.4 MPa reference. Operating pressure range 0.5–3.0 MPa typical.",
      "compatibility_notes": "Noble gas — generally compatible with SS, Inconel. Xenon procurement and containment mass penalty significant.",
      "hazards": "Asphyxiant at high concentration. Xenon high pressure vessel hazard."
    },
    {
      "working_fluid_id": "fluid-ammonia-v0",
      "schema_version": "v0.2.0",
      "label": "Ammonia (NH3) Two-Phase",
      "fluid_class": "phase_change_refrigerant",
      "phase_class": "two_phase_allowed",
      "temp_operating_min_k": 200,
      "temp_operating_max_k": 405,
      "cp_basis_j_per_kgk": 4745,
      "density_basis_kg_per_m3": 682,
      "thermal_conductivity_w_per_mk": 0.50,
      "viscosity_basis_pa_s": 1.4e-4,
      "gamma_ratio": null,
      "latent_heat_basis_j_per_kg": 1.37e6,
      "provenance_class": "sourced_authoritative",
      "confidence_class": "high",
      "maturity_class": "flight_proven",
      "research_required": false,
      "source_note": "ISS ATCS heritage fluid. NIST REFPROP / ASHRAE data. Liquid phase properties at 293 K reference.",
      "pressure_notes": "Saturation pressure ~1.0 MPa at 298 K. Design for full two-phase regime.",
      "compatibility_notes": "Incompatible with copper, zinc, brass. Compatible with aluminum, steel, titanium with correct passivation.",
      "hazards": "Toxic, corrosive, flammable at 15–28% by volume. Personnel exposure limits enforced."
    },
    {
      "working_fluid_id": "fluid-co2-v0",
      "schema_version": "v0.2.0",
      "label": "Carbon Dioxide (CO2) Supercritical/Two-Phase",
      "fluid_class": "molecular_gas",
      "phase_class": "two_phase_allowed",
      "temp_operating_min_k": 220,
      "temp_operating_max_k": 800,
      "cp_basis_j_per_kgk": 1200,
      "density_basis_kg_per_m3": 800,
      "thermal_conductivity_w_per_mk": 0.086,
      "viscosity_basis_pa_s": 6.5e-5,
      "gamma_ratio": 1.3,
      "latent_heat_basis_j_per_kg": 5.7e5,
      "provenance_class": "sourced_authoritative",
      "confidence_class": "high",
      "maturity_class": "trl_6_plus",
      "research_required": false,
      "source_note": "NIST REFPROP data. Supercritical region cp/density at ~8 MPa, 330 K. sCO2 Brayton cycle candidate.",
      "pressure_notes": "Critical point 304.1 K / 7.38 MPa. Supercritical operation requires high-pressure design.",
      "compatibility_notes": "Compatible with SS, titanium, nickel alloys. Watch moisture contamination.",
      "hazards": "Asphyxiant. High pressure vessel."
    },
    {
      "working_fluid_id": "fluid-water-v0",
      "schema_version": "v0.2.0",
      "label": "Water (H2O) Single Phase / Two Phase",
      "fluid_class": "water_family",
      "phase_class": "two_phase_allowed",
      "temp_operating_min_k": 274,
      "temp_operating_max_k": 647,
      "cp_basis_j_per_kgk": 4181,
      "density_basis_kg_per_m3": 998,
      "thermal_conductivity_w_per_mk": 0.598,
      "viscosity_basis_pa_s": 1.0e-3,
      "gamma_ratio": null,
      "latent_heat_basis_j_per_kg": 2.26e6,
      "provenance_class": "sourced_authoritative",
      "confidence_class": "high",
      "maturity_class": "flight_proven",
      "research_required": false,
      "source_note": "NIST IAPWS-IF97. Properties at 293 K / 0.1 MPa. Heritage use in ISS cooling loops.",
      "pressure_notes": "Low-pressure operation below 373 K. Freezing hazard below 273 K. Microgravity two-phase management required.",
      "compatibility_notes": "Use deionized water. Compatible with SS, titanium, coatings. Risk of biological growth in long-duration loops.",
      "hazards": "Freezing hazard in thermal cycling. Electrical hazard on short."
    },
    {
      "working_fluid_id": "fluid-sodium-v0",
      "schema_version": "v0.2.0",
      "label": "Sodium (Na) Liquid Metal",
      "fluid_class": "liquid_metal",
      "phase_class": "single_phase_liquid",
      "temp_operating_min_k": 371,
      "temp_operating_max_k": 1156,
      "cp_basis_j_per_kgk": 1260,
      "density_basis_kg_per_m3": 927,
      "thermal_conductivity_w_per_mk": 62,
      "viscosity_basis_pa_s": 3.5e-4,
      "gamma_ratio": null,
      "latent_heat_basis_j_per_kg": 4.27e6,
      "provenance_class": "sourced_authoritative",
      "confidence_class": "high",
      "maturity_class": "trl_6_plus",
      "research_required": true,
      "source_note": "IAEA liquid metal properties. Values at 800 K operating point. Nuclear plant heritage. Space reactor cooling candidate.",
      "pressure_notes": "Near-atmospheric operating pressure. Freeze protection required above 371 K (melt point).",
      "compatibility_notes": "Severe fire/explosion risk with water and air. SS-316 compatible at operational temperatures. Nitrogen inert blanket required.",
      "hazards": "Pyrophoric. Reacts violently with water. Highly toxic fire products."
    },
    {
      "working_fluid_id": "fluid-nak-v0",
      "schema_version": "v0.2.0",
      "label": "NaK-78 Eutectic Liquid Metal",
      "fluid_class": "liquid_metal",
      "phase_class": "single_phase_liquid",
      "temp_operating_min_k": 262,
      "temp_operating_max_k": 1058,
      "cp_basis_j_per_kgk": 870,
      "density_basis_kg_per_m3": 866,
      "thermal_conductivity_w_per_mk": 23,
      "viscosity_basis_pa_s": 3.0e-4,
      "gamma_ratio": null,
      "latent_heat_basis_j_per_kg": null,
      "provenance_class": "sourced_secondary",
      "confidence_class": "medium",
      "maturity_class": "trl_4_5",
      "research_required": true,
      "source_note": "NaK-78 (78% K, 22% Na by mass) eutectic. Liquidus ~262 K. Properties at 600 K from literature. Space reactor application candidate.",
      "pressure_notes": "Near-atmospheric operation. Lower melt point than sodium is key advantage.",
      "compatibility_notes": "Pyrophoric — same sodium family hazards. Compatible with SS at operation temps. Inert gas cover required.",
      "hazards": "Pyrophoric with air and water. Potassium component explosive with water. Personnel hazard significant."
    },
    {
      "working_fluid_id": "fluid-lithium-v0",
      "schema_version": "v0.2.0",
      "label": "Lithium (Li) Liquid Metal",
      "fluid_class": "liquid_metal",
      "phase_class": "single_phase_liquid",
      "temp_operating_min_k": 454,
      "temp_operating_max_k": 1620,
      "cp_basis_j_per_kgk": 4170,
      "density_basis_kg_per_m3": 512,
      "thermal_conductivity_w_per_mk": 43,
      "viscosity_basis_pa_s": 5.0e-4,
      "gamma_ratio": null,
      "latent_heat_basis_j_per_kg": 2.45e6,
      "provenance_class": "sourced_secondary",
      "confidence_class": "medium",
      "maturity_class": "trl_4_5",
      "research_required": true,
      "source_note": "Properties at 800 K from IAEA / literature. Highest-temp liquid metal loop candidate. Extremely high Cp favors mass efficiency.",
      "pressure_notes": "Melt point 454 K requires high freeze-protection margin. Near-atmospheric operation.",
      "compatibility_notes": "Reacts with nitrogen. Compatible with refractory metals (Mo, Ta, W, Nb) and some SS grades at temperatures. Strong material selection constraint.",
      "hazards": "Pyrophoric. Reacts violently with water and air. High melt point freeze protection critical."
    }
  ]
}
